library/src/amd_detail/rocblaslt/src/Tensile/Logic/asm_full/aquavanjaram/gfx942_80cu/Equality/aquavanjaram_Cijk_Alik_Bjlk_HHS_BH_UserArgs.yaml
- {MinimumRequiredVersion: 4.33.0}
- aquavanjaram
- gfx942
- [Device 0049, Device 0050]
    SolutionIndex: 0
    SolutionNameMin: Cijk_Alik_Bjlk_HHS_BH_UserArgs_MT64x32x64_MI16x16x1_SN_GRVWA8_GRVWB8_GSU1_GSUC0_GSUWGMRR0_K1_LBSPPA128_LBSPPB512_LPA16_LPB32_LRVW8_MIWT1_2_NLCB1_SU0_SUM0_SUS0_SVW1_VWA1_VWB2_WG64_4_1_WGM1_WGMXCC4_WGMXCCG80
    SolutionIndex: 1
    SolutionNameMin: Cijk_Alik_Bjlk_HHS_BH_UserArgs_MT256x192x64_MI16x16x1_SN_GRVWA8_GRVWB8_GSU1_GSUC0_GSUWGMRR0_K1_LBSPPA512_LBSPPB3072_LPA16_LPB0_LRVW8_MIWT4_12_NLCB3_SU0_SUM0_SUS0_SVW4_VWA4_VWB4_WG64_4_1_WGM1_WGMXCC4_WGMXCCG80
    SolutionIndex: 2
    SolutionNameMin: Cijk_Alik_Bjlk_HHS_BH_UserArgs_MT64x128x64_MI16x16x1_SN_GRVWA8_GRVWB8_GSU4_GSUC0_GSUWGMRR0_K1_LBSPPA512_LBSPPB2048_LPA16_LPB32_LRVW8_MIWT4_2_NLCB1_SU4_SUM0_SUS256_SVW4_VWA4_VWB2_WG16_16_1_WGM1_WGMXCC4_WGMXCCG80
    SolutionIndex: 3
    SolutionNameMin: Cijk_Alik_Bjlk_HHS_BH_UserArgs_MT128x256x64_MI16x16x1_SN_GRVWA8_GRVWB8_GSU1_GSUC0_GSUWGMRR0_K1_LBSPPA1024_LBSPPB4096_LPA16_LPB0_LRVW8_MIWT8_4_NLCB1_SU0_SUM0_SUS0_SVW8_VWA8_VWB4_WG16_16_1_WGM1_WGMXCC4_WGMXCCG80
    SolutionIndex: 4
    SolutionNameMin: Cijk_Alik_Bjlk_HHS_BH_UserArgs_MT128x256x64_MI16x16x1_SN_GRVWA8_GRVWB8_GSU1_GSUC0_GSUWGMRR0_K1_LBSPPA1024_LBSPPB4096_LPA16_LPB0_LRVW8_MIWT8_4_NLCB1_SU4_SUM0_SUS256_SVW8_VWA8_VWB4_WG16_16_1_WGM1_WGMXCC4_WGMXCCG80
    SolutionIndex: 5
    SolutionNameMin: Cijk_Alik_Bjlk_HHS_BH_UserArgs_MT160x192x64_MI16x16x1_SN_GRVWA8_GRVWB8_GSU1_GSUC0_GSUWGMRR0_K1_LBSPPA256_LBSPPB3072_LPA16_LPB16_LRVW8_MIWT10_3_NLCB3_SU4_SUM0_SUS256_SVW2_VWA2_VWB1_WG16_16_1_WGM1_WGMXCC4_WGMXCCG80
    SolutionIndex: 6
    SolutionNameMin: Cijk_Alik_Bjlk_HHS_BH_UserArgs_MT224x256x64_MI16x16x1_SN_GRVWA8_GRVWB8_GSU1_GSUC0_GSUWGMRR0_K1_LBSPPA256_LBSPPB4096_LPA16_LPB0_LRVW8_MIWT14_4_NLCB1_SU0_SUM0_SUS0_SVW2_VWA2_VWB4_WG16_16_1_WGM4_WGMXCC4_WGMXCCG80
    SolutionIndex: 7
    SolutionNameMin: Cijk_Alik_Bjlk_HHS_BH_UserArgs_MT96x32x64_MI16x16x1_SN_GRVWA8_GRVWB8_GSU1_GSUC0_GSUWGMRR0_K1_LBSPPA128_LBSPPB512_LPA16_LPB16_LRVW8_MIWT3_1_NLCB1_SU0_SUM0_SUS0_SVW1_VWA1_VWB1_WG32_8_1_WGM1_WGMXCC4_WGMXCCG80
    SolutionIndex: 8
    SolutionNameMin: Cijk_Alik_Bjlk_HHS_BH_UserArgs_MT128x128x64_MI16x16x1_SN_GRVWA8_GRVWB8_GSU4_GSUC0_GSUWGMRR0_K1_LBSPPA512_LBSPPB2048_LPA16_LPB0_LRVW8_MIWT4_4_NLCB1_SU0_SUM0_SUS0_SVW4_VWA4_VWB4_WG32_8_1_WGM1_WGMXCC4_WGMXCCG80
    SolutionIndex: 9
    SolutionNameMin: Cijk_Alik_Bjlk_HHS_BH_UserArgs_MT256x192x64_MI16x16x1_SN_GRVWA8_GRVWB8_GSU1_GSUC0_GSUWGMRR0_K1_LBSPPA1024_LBSPPB3072_LPA16_LPB32_LRVW8_MIWT8_6_NLCB3_SU0_SUM0_SUS0_SVW8_VWA8_VWB2_WG32_8_1_WGM1_WGMXCC4_WGMXCCG80
    SolutionIndex: 10
    SolutionNameMin: Cijk_Alik_Bjlk_HHS_BH_UserArgs_MT256x192x64_MI16x16x1_SN_GRVWA8_GRVWB8_GSU1_GSUC0_GSUWGMRR0_K1_LBSPPA1024_LBSPPB3072_LPA16_LPB32_LRVW8_MIWT8_6_NLCB3_SU0_SUM0_SUS0_SVW8_VWA8_VWB2_WG32_8_1_WGM4_WGMXCC4_WGMXCCG80
    SolutionIndex: 11
    SolutionNameMin: Cijk_Alik_Bjlk_HHS_BH_UserArgs_MT64x32x128_MI16x16x1_SN_GRVWA8_GRVWB8_GSU1_GSUC0_GSUWGMRR0_K1_LBSPPA256_LBSPPB512_LPA16_LPB32_LRVW8_MIWT1_2_NLCB1_SU0_SUM0_SUS0_SVW1_VWA1_VWB2_WG64_4_1_WGM1_WGMXCC4_WGMXCCG80
    SolutionIndex: 12
    SolutionNameMin: Cijk_Alik_Bjlk_HHS_BH_UserArgs_MT64x32x128_MI16x16x1_SN_GRVWA8_GRVWB8_GSU1_GSUC0_GSUWGMRR0_K1_LBSPPA256_LBSPPB512_LPA16_LPB32_LRVW8_MIWT1_2_NLCB1_SU4_SUM0_SUS256_SVW1_VWA1_VWB2_WG64_4_1_WGM1_WGMXCC4_WGMXCCG80
    SolutionIndex: 13
    SolutionNameMin: Cijk_Alik_Bjlk_HHS_BH_UserArgs_MT64x32x128_MI16x16x1_SN_GRVWA8_GRVWB8_GSU4_GSUC0_GSUWGMRR0_K1_LBSPPA256_LBSPPB512_LPA16_LPB32_LRVW8_MIWT1_2_NLCB1_SU0_SUM0_SUS0_SVW1_VWA1_VWB2_WG64_4_1_WGM1_WGMXCC4_WGMXCCG80
    SolutionIndex: 14
    SolutionNameMin: Cijk_Alik_Bjlk_HHS_BH_UserArgs_MT128x64x128_MI16x16x1_SN_GRVWA8_GRVWB8_GSU1_GSUC0_GSUWGMRR0_K1_LBSPPA512_LBSPPB1024_LPA16_LPB0_LRVW8_MIWT2_4_NLCB1_SU0_SUM0_SUS0_SVW2_VWA2_VWB4_WG64_4_1_WGM1_WGMXCC4_WGMXCCG80
    SolutionIndex: 15
    SolutionNameMin: Cijk_Alik_Bjlk_HHS_BH_UserArgs_MT128x64x128_MI16x16x1_SN_GRVWA8_GRVWB8_GSU4_GSUC0_GSUWGMRR0_K1_LBSPPA512_LBSPPB1024_LPA16_LPB0_LRVW8_MIWT2_4_NLCB1_SU0_SUM0_SUS0_SVW2_VWA2_VWB4_WG64_4_1_WGM1_WGMXCC4_WGMXCCG80
    SolutionIndex: 16
    SolutionNameMin: Cijk_Alik_Bjlk_HHS_BH_UserArgs_MT128x32x128_MI16x16x1_SN_GRVWA8_GRVWB8_GSU1_GSUC0_GSUWGMRR0_K1_LBSPPA512_LBSPPB512_LPA16_LPB32_LRVW8_MIWT2_2_NLCB1_SU4_SUM0_SUS256_SVW2_VWA2_VWB2_WG64_4_1_WGM1_WGMXCC4_WGMXCCG80
    SolutionIndex: 17
    SolutionNameMin: Cijk_Alik_Bjlk_HHS_BH_UserArgs_MT128x32x128_MI16x16x1_SN_GRVWA8_GRVWB8_GSU4_GSUC0_GSUWGMRR0_K1_LBSPPA512_LBSPPB512_LPA16_LPB32_LRVW8_MIWT2_2_NLCB1_SU4_SUM0_SUS256_SVW2_VWA2_VWB2_WG64_4_1_WGM1_WGMXCC4_WGMXCCG80
    SolutionIndex: 18
    SolutionNameMin: Cijk_Alik_Bjlk_HHS_BH_UserArgs_MT32x32x128_MI16x16x1_SN_GRVWA8_GRVWB8_GSU4_GSUC0_GSUWGMRR0_K1_LBSPPA256_LBSPPB512_LPA16_LPB16_LRVW8_MIWT1_1_NLCB1_SU4_SUM0_SUS256_SVW1_VWA1_VWB1_WG32_8_1_WGM1_WGMXCC4_WGMXCCG80
    SolutionIndex: 19
    SolutionNameMin: Cijk_Alik_Bjlk_HHS_BH_UserArgs_MT32x16x256_MI16x16x1_SN_GRVWA8_GRVWB8_GSU1_GSUC0_GSUWGMRR0_K1_LBSPPA512_LBSPPB256_LPA16_LPB16_LRVW8_MIWT1_1_NLCB1_SU0_SUM0_SUS0_SVW1_VWA1_VWB1_WG32_4_1_WGM1_WGMXCC4_WGMXCCG80
    SolutionIndex: 20
    SolutionNameMin: Cijk_Alik_Bjlk_HHS_BH_UserArgs_MT64x32x256_MI16x16x1_SN_GRVWA8_GRVWB8_GSU1_GSUC0_GSUWGMRR0_K1_LBSPPA512_LBSPPB512_LPA16_LPB32_LRVW8_MIWT1_2_NLCB1_SU0_SUM0_SUS0_SVW1_VWA1_VWB2_WG64_4_1_WGM1_WGMXCC4_WGMXCCG80
    SolutionIndex: 21
    SolutionNameMin: Cijk_Alik_Bjlk_HHS_BH_UserArgs_MT64x32x256_MI16x16x1_SN_GRVWA8_GRVWB8_GSU4_GSUC0_GSUWGMRR0_K1_LBSPPA512_LBSPPB512_LPA16_LPB32_LRVW8_MIWT1_2_NLCB1_SU0_SUM0_SUS0_SVW1_VWA1_VWB2_WG64_4_1_WGM1_WGMXCC4_WGMXCCG80
    SolutionIndex: 22
    SolutionNameMin: Cijk_Alik_Bjlk_HHS_BH_UserArgs_MT64x16x256_MI16x16x1_SN_GRVWA8_GRVWB8_GSU1_GSUC0_GSUWGMRR0_K1_LBSPPA512_LBSPPB256_LPA16_LPB16_LRVW8_MIWT1_1_NLCB1_SU0_SUM0_SUS0_SVW1_VWA1_VWB1_WG64_4_1_WGM1_WGMXCC4_WGMXCCG80
    SolutionIndex: 23
    SolutionNameMin: Cijk_Alik_Bjlk_HHS_BH_UserArgs_MT32x32x256_MI16x16x1_SN_GRVWA8_GRVWB8_GSU1_GSUC0_GSUWGMRR0_K1_LBSPPA512_LBSPPB512_LPA16_LPB16_LRVW8_MIWT1_1_NLCB1_SU0_SUM0_SUS0_SVW1_VWA1_VWB1_WG32_8_1_WGM1_WGMXCC4_WGMXCCG80
- - - [10240, 1920, 1, 1280, 10240, 10240, 1280, 1920]
    - [9, 116.01]
  - - [1280, 154, 1, 2048, 1280, 1280, 2048, 154]
    - [8, 40467.2]
  - - [1280, 1920, 1, 1280, 1280, 1280, 1280, 1920]
    - [3, 140140.0]
  - - [1280, 1920, 1, 5120, 1280, 1280, 5120, 1920]
    - [3, 161694.0]
  - - [1280, 32, 1, 1280, 1280, 1280, 1280, 32]
    - [19, 11824.2]
  - - [1280, 32, 1, 2048, 1280, 1280, 2048, 32]
    - [13, 14667.9]
  - - [1280, 32, 1, 5120, 1280, 1280, 5120, 32]
    - [21, 25893.9]
  - - [1280, 77, 1, 1280, 1280, 1280, 1280, 77]
    - [11, 19711.9]
  - - [1280, 77, 1, 5120, 1280, 1280, 5120, 77]
    - [15, 37774.2]
  - - [15360, 15360, 1, 512, 15360, 15360, 512, 15360]
    - [6, 144293.0]
  - - [2048, 32, 1, 1280, 2048, 2048, 1280, 32]
    - [23, 17123.0]
  - - [2560, 34, 1, 1280, 2560, 2560, 1280, 34]
    - [12, 17628.3]
  - - [3072, 77, 1, 768, 3072, 3072, 768, 77]
    - [16, 29001.4]
  - - [512, 15360, 1, 512, 512, 512, 512, 15360]
    - [1, 127012.0]
  - - [5120, 32, 1, 1280, 5120, 5120, 1280, 32]
    - [20, 33803.1]
  - - [5120, 7680, 1, 640, 5120, 5120, 640, 7680]
    - [10, 148941.0]
  - - [5120, 77, 1, 1280, 5120, 5120, 1280, 77]
    - [14, 43895.8]
  - - [640, 154, 1, 2048, 640, 640, 2048, 154]
    - [2, 24162.1]
  - - [640, 32, 1, 2048, 640, 640, 2048, 32]
    - [18, 8348.49]
  - - [640, 7680, 1, 2560, 640, 640, 2560, 7680]
    - [4, 156745.0]
  - - [640, 7680, 1, 640, 640, 640, 640, 7680]
    - [5, 127311.0]
  - - [768, 77, 1, 3072, 768, 768, 3072, 77]
    - [17, 22739.4]
  - - [768, 77, 1, 768, 768, 768, 768, 77]
    - [22, 10653.6]
  - - [77, 77, 12, 64, 77, 77, 64, 77]
    - [0, 1764.23]
  - - [77, 77, 20, 64, 77, 77, 64, 77]
    - [7, 2621.46]
- null
- null
- DeviceEfficiency
- GridBased
